{
  "date": "2030-01-15",
  "mode": "breath",
  "truth_status": "written_today",
  "intended_reader": "future self",
  "observed": ["I postponed one task and completed a smaller maintenance job."],
  "felt": ["I felt frustrated by the change in plan."],
  "interpreted": ["I initially treated the change as failure."],
  "unknown": ["I do not yet know whether the postponed task will affect the schedule."],
  "connection": "Plans are useful, but reality retains final authority.",
  "challenge_point": "Was the smaller task responsible reprioritization or avoidance?",
  "closing": "Record the change, protect the next step, and return."
}
